{
  "$schema": "https://json-schema.org/draft/2020-12/schema",
  "title": "Stats",
  "description": "GET /stats. counts only source = wild.",
  "type": "object",
  "properties": {
    "total_sessions": {
      "type": "integer",
      "minimum": 0
    },
    "active_now": {
      "type": "integer",
      "minimum": 0
    },
    "countries": {
      "type": "integer",
      "minimum": 0,
      "description": "distinct countries seen"
    },
    "breaches": {
      "type": "integer",
      "minimum": 0,
      "description": "sessions that logged in successfully"
    },
    "by_kind": {
      "$ref": "#/$defs/ByKind"
    },
    "by_reputation": {
      "$ref": "#/$defs/ByReputation"
    },
    "per_minute": {
      "type": "array",
      "items": {
        "$ref": "#/$defs/MinuteBucket"
      }
    }
  },
  "required": [
    "total_sessions",
    "active_now",
    "countries",
    "breaches",
    "by_kind",
    "by_reputation",
    "per_minute"
  ],
  "additionalProperties": false,
  "$defs": {
    "ByKind": {
      "type": "object",
      "title": "ByKind",
      "properties": {
        "bot": {
          "type": "integer",
          "minimum": 0
        },
        "human": {
          "type": "integer",
          "minimum": 0
        },
        "agent": {
          "type": "integer",
          "minimum": 0
        },
        "unknown": {
          "type": "integer",
          "minimum": 0
        }
      },
      "required": [
        "bot",
        "human",
        "agent",
        "unknown"
      ],
      "additionalProperties": false
    },
    "ByReputation": {
      "type": "object",
      "title": "ByReputation",
      "properties": {
        "harmless": {
          "type": "integer",
          "minimum": 0
        },
        "unknown": {
          "type": "integer",
          "minimum": 0
        },
        "malicious": {
          "type": "integer",
          "minimum": 0
        }
      },
      "required": [
        "harmless",
        "unknown",
        "malicious"
      ],
      "additionalProperties": false
    },
    "MinuteBucket": {
      "type": "object",
      "title": "MinuteBucket",
      "properties": {
        "t": {
          "type": "string",
          "pattern": "^\\d{4}-\\d{2}-\\d{2}T\\d{2}:\\d{2}:\\d{2}(\\.\\d{1,6})?Z$",
          "description": "start of the minute, utc"
        },
        "bot": {
          "type": "integer",
          "minimum": 0
        },
        "human": {
          "type": "integer",
          "minimum": 0
        },
        "agent": {
          "type": "integer",
          "minimum": 0
        }
      },
      "required": [
        "t",
        "bot",
        "human",
        "agent"
      ],
      "additionalProperties": false
    }
  }
}
